{
  "schemaVersion": "1.0.0",
  "id": "rsm.local.001",
  "tenantId": "tenant.local",
  "status": "passed",
  "mode": "local-filesystem",
  "backupDir": "var/backups/restore-smoke-2026-04-24T12-00-00-000Z",
  "scratchDir": "var/ops/restore-smoke/restore-smoke-2026-04-24T12-00-00-000Z",
  "checks": [
    {
      "name": "sqlite-copy",
      "status": "passed",
      "details": "SQLite file copied into the scratch restore."
    },
    {
      "name": "object-store-copy",
      "status": "passed",
      "details": "Object store copied into scratch restore."
    }
  ],
  "stats": {
    "dbFileCopied": true,
    "objectCount": 42,
    "byteLength": 1048576,
    "releaseBundleCount": 1,
    "renderedManifestCount": 1,
    "schemaValidatedArtifactCount": 12,
    "schemaValidationFailureCount": 0,
    "objectReferenceCount": 42,
    "missingObjectReferenceCount": 0,
    "deliveryVerificationCount": 1,
    "failedDeliveryVerificationCount": 0
  },
  "createdBy": "local-operator",
  "startedAt": "2026-04-24T12:00:00Z",
  "completedAt": "2026-04-24T12:01:00Z"
}
